id,user_name,text
1,MdB_Beispiel1,"Die Menschen in unserem Land haben es satt, von einer abgehobenen Elite in Berlin bevormundet zu werden. Wir müssen endlich wieder auf das Volk hören!"
2,MdB_Beispiel2,"Heute im Ausschuss über die Reform des Vergaberechts diskutiert. Ein technisches, aber wichtiges Thema für mehr Effizienz in der Verwaltung."
3,MdB_Beispiel3,"Die sogenannten Experten in ihren Elfenbeintürmen haben schon wieder versagt. Zeit, dass die einfachen Bürger wieder das Sagen haben."
4,MdB_Beispiel4,"Freue mich, morgen beim Bürgerdialog in meinem Wahlkreis über die geplante Radwegausbau zu sprechen. Alle sind herzlich eingeladen!"
5,MdB_Beispiel5,"Die Lügenpresse und die korrupten Eliten wollen uns nicht die Wahrheit sagen. Aber das Volk lässt sich nicht länger täuschen!"
6,MdB_Beispiel6,"Kurzer Rückblick auf die Plenardebatte zur Energiepolitik. Konstruktiver Austausch mit Kolleginnen und Kollegen aller Fraktionen."
7,MdB_Beispiel7,"Es reicht! Die politische Klasse in Berlin hat den Kontakt zur Realität der hart arbeitenden Bevölkerung komplett verloren."
8,MdB_Beispiel8,"Neue Studie zur Bildungsgerechtigkeit veröffentlicht. Wir brauchen mehr Investitionen in frühkindliche Förderung."
9,MdB_Beispiel9,"Während die Mächtigen in ihren Villen sitzen, kämpft der normale Bürger ums Überleben. Diese Ungerechtigkeit muss endlich enden!"
10,MdB_Beispiel10,"Dank an alle, die heute bei der Podiumsdiskussion zum Klimaschutz dabei waren. Gute Fragen aus dem Publikum!"
